{
  "$schema": "https://json-schema.org/draft/2020-12/schema",
  "$id": "environment.schema.json",
  "title": "Environment",
  "type": "object",
  "required": ["id", "name", "minecraftVersion", "loaderType", "serverCore", "createdAt", "updatedAt"],
  "properties": {
    "id": {"type": "string"},
    "name": {"type": "string"},
    "description": {"type": "string"},
    "minecraftVersion": {"type": "string"},
    "javaVersion": {"type": "string"},
    "loaderType": {"enum": ["none", "fabric", "liteloader", "forge", "quilt", "custom"]},
    "loaderVersion": {"type": "string"},
    "serverCore": {"enum": ["vanilla", "fabric", "carpet", "paper", "forge", "custom"]},
    "mcdrRequired": {"type": "boolean"},
    "carpetRequired": {"type": "boolean"},
    "lucyManifestRef": {"type": "string"},
    "lucyLockRef": {"type": "string"},
    "runtimeProfileId": {"type": "string"},
    "runtimeProfileRequired": {"type": "boolean"},
    "artifactPolicyId": {"type": "string"},
    "notes": {"type": "string"},
    "createdAt": {"type": "string", "format": "date-time"},
    "updatedAt": {"type": "string", "format": "date-time"},
    "metadata": {"type": "object", "additionalProperties": {"type": "string"}}
  },
  "additionalProperties": false
}
