{
  "id": "gtmc-1.17-base",
  "name": "GTMC 1.17 Fabric Carpet + MCDR",
  "description": "Base environment for GTMC 1.17.1 technical testing: Fabric loader, Carpet mod, Fabric API, MCDR wrapper.",
  "minecraftVersion": "1.17.1",
  "javaVersion": "16",
  "loaderType": "fabric",
  "loaderVersion": "0.14.24",
  "serverCore": "fabric",
  "mcdrRequired": true,
  "carpetRequired": true,
  "lucyManifestRef": "manifests/gtmc-1.17-base.lucy.yaml",
  "lucyLockRef": "manifests/gtmc-1.17-base.lucy.lock",
  "runtimeProfileId": "mcdr-fabric-1.17",
  "runtimeProfileRequired": true,
  "artifactPolicyId": "",
  "notes": "Materialization: Lucy resolves Fabric + Carpet + API packages into session mods/. MCDR config.yml start_command points to fabric-server-launch.jar (deployed as Stratum Artifact).",
  "createdAt": "2026-06-19T00:00:00Z",
  "updatedAt": "2026-06-19T00:00:00Z",
  "metadata": {
    "targetCommunity": "GTMC",
    "lucyRequired": "true",
    "mcdrProfile": "mcdr-fabric-1.17"
  }
}
